{
    "$schema": "https://json-schema.org/draft/2020-12/schema",
    "$id": "https://smart-cut-reel/contracts/service_status.schema.json",
    "title": "Smart Cut Reel Service Status",
    "description": "Execution status for pipeline presets: reframe-only, dead-air + reframe, and audio-quality + dead-air + reframe.",
    "type": "object",
    "additionalProperties": false,
    "required": [
        "schema_version",
        "job_id",
        "status",
        "current_step",
        "updated_at",
        "steps",
        "warnings",
        "errors"
    ],
    "properties": {
        "schema_version": {
            "type": "string",
            "enum": [
                "1.0.0",
                "2.0.0",
                "3.0.0"
            ]
        },
        "job_id": {
            "type": "string",
            "pattern": "^job_[A-Za-z0-9_-]+$"
        },
        "status": {
            "type": "string",
            "enum": [
                "pending",
                "running",
                "success",
                "failed"
            ]
        },
        "current_step": {
            "anyOf": [
                {
                    "$ref": "#/$defs/stepName"
                },
                {
                    "type": "null"
                }
            ]
        },
        "updated_at": {
            "type": "string",
            "format": "date-time"
        },
        "steps": {
            "oneOf": [
                {
                    "$ref": "#/$defs/stepsReframeOnly"
                },
                {
                    "$ref": "#/$defs/stepsSmoothAudioChain"
                },
                {
                    "$ref": "#/$defs/stepsDeadAirChain"
                },
                {
                    "$ref": "#/$defs/stepsDeadAirEnhancedChain"
                },
                {
                    "$ref": "#/$defs/stepsAudioQualityChain"
                }
            ]
        },
        "warnings": {
            "type": "array",
            "items": {
                "$ref": "#/$defs/warning"
            }
        },
        "errors": {
            "type": "array",
            "items": {
                "type": "string",
                "minLength": 1
            }
        },
        "progress": {
            "type": "object",
            "additionalProperties": false,
            "required": ["current_seconds", "total_seconds", "percent"],
            "properties": {
                "current_seconds": { "type": "number", "minimum": 0 },
                "total_seconds": { "type": "number", "minimum": 0 },
                "percent": { "type": "number", "minimum": 0, "maximum": 100 }
            }
        }
    },
    "$defs": {
        "stepName": {
            "type": "string",
            "enum": [
                "validation",
                "media_metadata",
                "audio_extraction",
                "audio_enhancement",
                "voice_activity_detection",
                "transcription",
                "dead_air_cut_planning",
                "proxy_frame_sampling",
                "body_detection",
                "track_interpolation",
                "reframe_planning",
                "easing_smoothing",
                "render_plan_compiler",
                "ffmpeg_renderer"
            ]
        },
        "nullableDateTime": {
            "anyOf": [
                {
                    "type": "string",
                    "format": "date-time"
                },
                {
                    "type": "null"
                }
            ]
        },
        "stepState": {
            "type": "object",
            "additionalProperties": false,
            "required": [
                "status",
                "started_at",
                "finished_at"
            ],
            "properties": {
                "status": {
                    "type": "string",
                    "enum": [
                        "pending",
                        "running",
                        "success",
                        "failed"
                    ]
                },
                "started_at": {
                    "$ref": "#/$defs/nullableDateTime"
                },
                "finished_at": {
                    "$ref": "#/$defs/nullableDateTime"
                },
                "metrics": {
                    "type": "object",
                    "description": "Optional per-step metrics returned by the service (e.g. audio_enhancement loudness/peak fields).",
                    "additionalProperties": true
                }
            }
        },
        "stepsReframeOnly": {
            "type": "object",
            "additionalProperties": false,
            "required": [
                "validation",
                "media_metadata",
                "proxy_frame_sampling",
                "body_detection",
                "track_interpolation",
                "reframe_planning",
                "easing_smoothing",
                "render_plan_compiler",
                "ffmpeg_renderer"
            ],
            "properties": {
                "validation": {
                    "$ref": "#/$defs/stepState"
                },
                "media_metadata": {
                    "$ref": "#/$defs/stepState"
                },
                "proxy_frame_sampling": {
                    "$ref": "#/$defs/stepState"
                },
                "body_detection": {
                    "$ref": "#/$defs/stepState"
                },
                "track_interpolation": {
                    "$ref": "#/$defs/stepState"
                },
                "reframe_planning": {
                    "$ref": "#/$defs/stepState"
                },
                "easing_smoothing": {
                    "$ref": "#/$defs/stepState"
                },
                "render_plan_compiler": {
                    "$ref": "#/$defs/stepState"
                },
                "ffmpeg_renderer": {
                    "$ref": "#/$defs/stepState"
                }
            }
        },
        "stepsSmoothAudioChain": {
            "type": "object",
            "additionalProperties": false,
            "required": [
                "validation",
                "media_metadata",
                "audio_extraction",
                "audio_enhancement",
                "proxy_frame_sampling",
                "body_detection",
                "track_interpolation",
                "reframe_planning",
                "easing_smoothing",
                "render_plan_compiler",
                "ffmpeg_renderer"
            ],
            "properties": {
                "validation": {
                    "$ref": "#/$defs/stepState"
                },
                "media_metadata": {
                    "$ref": "#/$defs/stepState"
                },
                "audio_extraction": {
                    "$ref": "#/$defs/stepState"
                },
                "audio_enhancement": {
                    "$ref": "#/$defs/stepState"
                },
                "proxy_frame_sampling": {
                    "$ref": "#/$defs/stepState"
                },
                "body_detection": {
                    "$ref": "#/$defs/stepState"
                },
                "track_interpolation": {
                    "$ref": "#/$defs/stepState"
                },
                "reframe_planning": {
                    "$ref": "#/$defs/stepState"
                },
                "easing_smoothing": {
                    "$ref": "#/$defs/stepState"
                },
                "render_plan_compiler": {
                    "$ref": "#/$defs/stepState"
                },
                "ffmpeg_renderer": {
                    "$ref": "#/$defs/stepState"
                }
            }
        },
        "stepsDeadAirChain": {
            "type": "object",
            "additionalProperties": false,
            "required": [
                "validation",
                "media_metadata",
                "audio_extraction",
                "voice_activity_detection",
                "dead_air_cut_planning",
                "proxy_frame_sampling",
                "body_detection",
                "track_interpolation",
                "reframe_planning",
                "easing_smoothing",
                "render_plan_compiler",
                "ffmpeg_renderer"
            ],
            "properties": {
                "validation": {
                    "$ref": "#/$defs/stepState"
                },
                "media_metadata": {
                    "$ref": "#/$defs/stepState"
                },
                "audio_extraction": {
                    "$ref": "#/$defs/stepState"
                },
                "voice_activity_detection": {
                    "$ref": "#/$defs/stepState"
                },
                "dead_air_cut_planning": {
                    "$ref": "#/$defs/stepState"
                },
                "proxy_frame_sampling": {
                    "$ref": "#/$defs/stepState"
                },
                "body_detection": {
                    "$ref": "#/$defs/stepState"
                },
                "track_interpolation": {
                    "$ref": "#/$defs/stepState"
                },
                "reframe_planning": {
                    "$ref": "#/$defs/stepState"
                },
                "easing_smoothing": {
                    "$ref": "#/$defs/stepState"
                },
                "render_plan_compiler": {
                    "$ref": "#/$defs/stepState"
                },
                "ffmpeg_renderer": {
                    "$ref": "#/$defs/stepState"
                }
            }
        },
        "stepsDeadAirEnhancedChain": {
            "type": "object",
            "additionalProperties": false,
            "required": [
                "validation",
                "media_metadata",
                "audio_extraction",
                "audio_enhancement",
                "voice_activity_detection",
                "dead_air_cut_planning",
                "proxy_frame_sampling",
                "body_detection",
                "track_interpolation",
                "reframe_planning",
                "easing_smoothing",
                "render_plan_compiler",
                "ffmpeg_renderer"
            ],
            "properties": {
                "validation": {
                    "$ref": "#/$defs/stepState"
                },
                "media_metadata": {
                    "$ref": "#/$defs/stepState"
                },
                "audio_extraction": {
                    "$ref": "#/$defs/stepState"
                },
                "audio_enhancement": {
                    "$ref": "#/$defs/stepState"
                },
                "voice_activity_detection": {
                    "$ref": "#/$defs/stepState"
                },
                "dead_air_cut_planning": {
                    "$ref": "#/$defs/stepState"
                },
                "proxy_frame_sampling": {
                    "$ref": "#/$defs/stepState"
                },
                "body_detection": {
                    "$ref": "#/$defs/stepState"
                },
                "track_interpolation": {
                    "$ref": "#/$defs/stepState"
                },
                "reframe_planning": {
                    "$ref": "#/$defs/stepState"
                },
                "easing_smoothing": {
                    "$ref": "#/$defs/stepState"
                },
                "render_plan_compiler": {
                    "$ref": "#/$defs/stepState"
                },
                "ffmpeg_renderer": {
                    "$ref": "#/$defs/stepState"
                }
            }
        },
        "stepsAudioQualityChain": {
            "type": "object",
            "additionalProperties": false,
            "required": [
                "validation",
                "media_metadata",
                "audio_extraction",
                "audio_enhancement",
                "voice_activity_detection",
                "transcription",
                "dead_air_cut_planning",
                "proxy_frame_sampling",
                "body_detection",
                "track_interpolation",
                "reframe_planning",
                "easing_smoothing",
                "render_plan_compiler",
                "ffmpeg_renderer"
            ],
            "properties": {
                "validation": {
                    "$ref": "#/$defs/stepState"
                },
                "media_metadata": {
                    "$ref": "#/$defs/stepState"
                },
                "audio_extraction": {
                    "$ref": "#/$defs/stepState"
                },
                "audio_enhancement": {
                    "$ref": "#/$defs/stepState"
                },
                "voice_activity_detection": {
                    "$ref": "#/$defs/stepState"
                },
                "transcription": {
                    "$ref": "#/$defs/stepState"
                },
                "dead_air_cut_planning": {
                    "$ref": "#/$defs/stepState"
                },
                "proxy_frame_sampling": {
                    "$ref": "#/$defs/stepState"
                },
                "body_detection": {
                    "$ref": "#/$defs/stepState"
                },
                "track_interpolation": {
                    "$ref": "#/$defs/stepState"
                },
                "reframe_planning": {
                    "$ref": "#/$defs/stepState"
                },
                "easing_smoothing": {
                    "$ref": "#/$defs/stepState"
                },
                "render_plan_compiler": {
                    "$ref": "#/$defs/stepState"
                },
                "ffmpeg_renderer": {
                    "$ref": "#/$defs/stepState"
                }
            }
        },
        "warning": {
            "type": "object",
            "additionalProperties": false,
            "required": [
                "code",
                "message",
                "step",
                "created_at"
            ],
            "properties": {
                "code": {
                    "type": "string",
                    "pattern": "^[A-Z0-9_]+$"
                },
                "message": {
                    "type": "string",
                    "minLength": 1
                },
                "step": {
                    "$ref": "#/$defs/stepName"
                },
                "created_at": {
                    "type": "string",
                    "format": "date-time"
                }
            }
        }
    }
}
